{
  "$schema": "https://json-schema.org/draft/2020-12/schema",
  "$id": "https://rome-protocol.github.io/registry/schema/chain.schema.json",
  "title": "Rome chain — core identity",
  "type": "object",
  "required": ["chainId", "name", "network", "rpcUrl", "nativeCurrency", "status"],
  "additionalProperties": false,
  "properties": {
    "chainId":     { "type": "integer", "minimum": 1 },
    "name":        { "type": "string", "minLength": 1 },
    "network":     { "enum": ["mainnet", "testnet", "devnet", "local"] },
    "rpcUrl":      { "type": "string", "format": "uri" },
    "explorerUrl": { "type": "string", "format": "uri" },
    "romeEvmProgramId": {
      "type": "string",
      "pattern": "^[1-9A-HJ-NP-Za-km-z]{32,44}$",
      "description": "Rome EVM program ID (Solana base58) this chain is registered under. Required for new chains: the post-clean-slate registry has no canonical default to fall back on (legacy `DP1dshBzmXXVsRxH5kCKMemrDuptg1JvJ1j5AsFV4Hm3` closed 2026-05-02). Once the next primary rome-evm program is deployed (Phase 5), `programs/index.json#primary[<cluster>]` becomes the authoritative pointer; chains running a custom rome-evm fork (e.g. meta-hook test branches) still declare their own. Schema keeps the field optional for the v0.3.x → v0.4.x compat window (legacy `solanaProgramId` is still read as a deprecated alias). Added v0.4.0 — supersedes `solanaProgramId`."
    },
    "solanaProgramId": {
      "type": "string",
      "pattern": "^[1-9A-HJ-NP-Za-km-z]{32,44}$",
      "description": "DEPRECATED v0.4.0 — use `romeEvmProgramId`. Same semantics: the Rome EVM program ID this chain is registered under. Retained as an optional alias for one minor cycle so external consumers can migrate; will be removed in v1.0.0. Consumers should prefer `romeEvmProgramId` when both are present."
    },
    "nativeCurrency": {
      "type": "object",
      "required": ["name", "symbol", "decimals"],
      "additionalProperties": false,
      "properties": {
        "name":     { "type": "string" },
        "symbol":   { "type": "string" },
        "decimals": { "type": "integer", "minimum": 0, "maximum": 18 }
      }
    },
    "status": { "enum": ["live", "preparing", "retired"] },
    "solana": {
      "type": "object",
      "required": ["cluster"],
      "additionalProperties": false,
      "description": "Per-chain Solana settlement target + compatibility tracking. Added v0.3.0.",
      "properties": {
        "cluster": {
          "enum": ["mainnet", "devnet"],
          "description": "Which Solana cluster this Rome chain settles to. Rome only targets mainnet and devnet — never Solana testnet (Rome's testnet rollups use Solana devnet)."
        },
        "tested": {
          "type": "object",
          "required": ["version", "verifiedAt"],
          "additionalProperties": false,
          "description": "Last Solana version this chain's stack (proxy + hercules + rhea) was verified compatible with.",
          "properties": {
            "version":    { "type": "string", "pattern": "^[0-9]+\\.[0-9]+\\.[0-9]+(-[A-Za-z0-9.]+)?$" },
            "verifiedAt": { "type": "string", "format": "date" },
            "notes":      { "type": "string" }
          }
        },
        "romeRpcUrl": {
          "type": "string",
          "format": "uri",
          "description": "Optional. Rome's own Solana RPC URL this chain's services connect to. Operator-private — partner-self-hosted chains may omit."
        },
        "romeNodeVersion": {
          "type": "string",
          "pattern": "^[0-9]+\\.[0-9]+\\.[0-9]+(-[A-Za-z0-9.]+)?$",
          "description": "Optional. Solana version Rome runs on its node for this chain. Cross-reference with solana/clusters.json#romeNodeVersion."
        }
      }
    }
  }
}
