{
  "chainId": 121301,
  "name": "Rome Marcus",
  "network": "devnet",
  "rpcUrl": "https://marcus.devnet.romeprotocol.xyz/",
  "explorerUrl": "https://via-marcus.devnet.romeprotocol.xyz/",
  "nativeCurrency": {
    "name": "Rome Marcus",
    "symbol": "USDC",
    "decimals": 18
  },
  "status": "preparing",
  "romeEvmProgramId": "RomeDbGQYbqomGVk13h9JkQHKoNWKB84Lw1ij9AtRXT",
  "solana": {
    "cluster": "devnet"
  }
}
