{
  "chainId": 999999,
  "name": "Rome Fixture",
  "network": "testnet",
  "rpcUrl": "https://fixture.devnet.romeprotocol.xyz/",
  "explorerUrl": "https://via-fixture.devnet.romeprotocol.xyz/",
  "romeEvmProgramId": "Fixture111111111111111111111111111111111111",
  "nativeCurrency": { "name": "Rome Fixture", "symbol": "USDC", "decimals": 18 },
  "status": "live"
}
