{
  "chainId": 121225,
  "name": "Rome Esquiline",
  "network": "devnet",
  "rpcUrl": "https://esquiline.devnet.romeprotocol.xyz/",
  "explorerUrl": "https://romescout-esquiline.devnet.romeprotocol.xyz/",
  "solanaProgramId": "DP1dshBzmXXVsRxH5kCKMemrDuptg1JvJ1j5AsFV4Hm3",
  "nativeCurrency": {
    "name": "Rome Esquiline",
    "symbol": "USDC",
    "decimals": 18
  },
  "status": "live",
  "solana": {
    "cluster": "devnet",
    "tested": {
      "version": "4.0.0-beta.6",
      "verifiedAt": "2026-04-27"
    },
    "romeNodeVersion": "4.0.0-beta.7"
  }
}
