{
  "chainId": 121215,
  "name": "Rome Maximus",
  "network": "devnet",
  "rpcUrl": "https://maximus.devnet.romeprotocol.xyz/",
  "explorerUrl": "https://romescout-maximus.devnet.romeprotocol.xyz/",
  "romeEvmProgramId": "CX3vRqzv1y7EEf3zr7myXz7UnwJMf2GiP1fUZZpVynSs",
  "nativeCurrency": {
    "name": "Rome Maximus",
    "symbol": "RSOL",
    "decimals": 18
  },
  "status": "retired",
  "solana": {
    "cluster": "devnet",
    "tested": {
      "version": "4.0.0-beta.6",
      "verifiedAt": "2026-04-27"
    },
    "romeNodeVersion": "4.0.0-beta.7"
  }
}
